,text
0,oh and i forgot to also mention the weird color effect it has on your phone
1,that one didn't work either
2,waste of 13 bucks
3,product is useless since it does not have enough charging current to charge the 2 cellophane i was planning to use it with
4,none of the three sizes they sent with the heads would stay in my ears
5,worst customer service
6,the nagged is still lacking in ear
7,it always cuts out and makes a beep beep beep sound then says signal failed
8,the only very disappointing thing was there was no speaker
9,very disappointed in accessory
10,basically the service was very bad
11,bad choice
12,the only thing that disappointing me is the infra red port ire
13,horrible had to switch 3 times
14,it feels poorly constructed the menus are difficult to navigate and the buttons are so recessed that it is difficult to push them
15,don't make the same mistake i did
16,muddy low quality sound and the casino around the wire insert was poorly super glued and slid off
17,i advise everyone do not be fooled
18,doesn't hold charge
19,what a waste of time
20,investigation very disappointed with my decision
21,i also didn't like the on button it felt like it would crack with use
22,i bought these hoping i could make my blue heads fit better but these things made it impossible to wear
23,we have tried 2 units and they both failed within 2 months pros
24,also difficult to put on it'd recommend avoiding this product
25,50 down the drain
26,absolutely junk
27,can't store anything but phone numbers to simple
28,very disappointing
29,i would not recommend this item to anyone
30,big disappointment with calendar synce
31,not impressed
32,just does not work
33,i even fully charged it before i went to bed and turned off blue tooth and win and noticed that it only had 20 left in the morning
34,plus i seriously do not believe it is worth its steep price point
35,in my house i was getting dropped coverage upstairs and no coverage in my basement
36,the phone takes forever to charge like 2 to 5 hours literally
37,very unreliable service from two-mile
38,down the drain because of a weak snap
39,this is a simple little phone to use but the breakage is unacceptable
40,pretty piece of junk
41,this is so embarrassing and also my ears hurt if i try to push the ear plug into my ear
42,unfortunately the ability to actually know you are receiving a call is a rather important feature and this phone is pitiful in that respect
43,this is the first phone invest had that has been so cheaply made
44,awkward to use and unreliable
45,horrible phone
46,if you are looking for a good quality motor heads keep looking this isn't it
47,my father has the voters and the battery is dying
48,after a year the battery went completely dead on my heads
49,defective crap
50,poor construction
51,they work about 2 weeks then break
52,could not get strong enough signal
53,i really wanted the plant 510 to be the right one but it has too many issues for me the good
54,excellent starter wires heads
55,performed awful muffled tiny incoming sound and severe echo for those on the other end of the call
56,been battery junk
57,the design might be economic in theory but i could not stand having these in my ear
58,camera color balance is awful
59,it ditty not work most of the time with my nooks 532
60,looks good in the picture but this case was a huge disappointment
61,invest had this blue heads for some time now and still not comfortable with the way it fits on the ear
62,plug was the wrong size
63,the phone was usable and was not new
64,if i take a picture the battery drops a bar and starts beep letting me know its dining
65,it's so stupid to have to keep buying new charge car charge cradles headstones and car kits every time a new phone comes out
66,poor quality and service
67,poor product
68,investigation a bit disappointed
69,i tried talking real loud but shouting on the telephone gets old and i was still told it wasn't great
70,there's a horrible tick sound in the background on all my calls that i have never experienced before
71,the design is very odd as the ear clip is not very comfortable at all
72,at first i thought i was getting a good deal at 7 44 until i plugged it into my phone voters razor
73,don buy it
74,so there is no way for me to plug it in here in the us unless i go by a converted
75,soy technology suck
76,doesn't last long
77,still waiting investigation sure this item would work well if i ever relieve it
78,poorly construct hinge
79,think it over when you plan to own this one this sure is the last motor phone for me
80,problem is that the ear loops are made of weak material and break easily
81,the bottom line another worthless cheap gimme from sprinted
82,this pair of headstones is the worst that i have ever had sound
83,att is not clear sound is very distorted and you have to yell when you talk
84,i would advise to not purchase this item it never worked very well
85,it doesn't make you look cool
86,bought mainly for the charge which broke soon after purchasing
87,i put the latest os on it voters 15 and it now likes to slow to a crawl and lock up every once in a while
88,there's really nothing bad i can say about this heads
89,we are sending it back
90,i came over from verie because circulating has nicer cell phones the first thing i noticed was the really bad service
91,unreliable investigation giving up
92,after my phone got to be about a year old it's been slowly breaking despite much care on my part
93,it was a waste of my money
94,don't waste your money and time
95,due to this happening on every call i was forced to stop using this heads
96,i checked everywhere and there is no feature for it which is really disappointing
97,does not fit
98,it'll be looking for a new eyepiece
99,however the key are so tiny that i sometimes reach the wrong buttons
100,unfortunately it did not work
101,couldn't figure it out
102,worst soft ever used if i could give this zero stars i would
103,lousy product
104,lasted one day and then blew up
105,i bought it for my mother and she had a problem with the battery
106,i was not impressed by this product
107,not enough volume
108,buyer be very careful
109,were jerks on the phone
110,but when i check voice mail at night the key back-lighted turns off a few seconds into the first message and then investigation lost
111,disappointing results
112,i got the car charge and not even after a week the charge was broken i went to plug it in and it started smoking
113,i find this inexcusable and so will probably be returning this phone and perhaps changing carriers
114,you get what you pay for i guess
115,bad quality
116,it's not what it says it is
117,it's kind of embarrassing to use because of how it looks and mostly it's embarrassing how childlike the company is
118,all in all it'd expected a better consumer experience from motor
119,sending it back
120,everything about this product is wrong first
121,it is cheap and it feel and look just as cheap
122,after receiving and using the product for just 2 days it broke
123,phone falls out easily
124,the first thing that happened was that the tracking was off
125,links should have some way to exchange a bad phone for a refurbished unit or something
126,a must study for anyone interested in the worst sins of industrial design
127,the been heads was such a disappointment
128,i have had this phone for over a year now and i will tell you its not that great
129,what a piece of junk i lose more calls on this phone
130,doesn't work at all i bough it for my laws and its not working
131,very disappointed
132,ear piece breaks easily
133,i can barely ever hear on it and am constantly saying what
134,it doesn't work in eloped or aside
135,i ordered this product first and was unhappy with it immediately
136,investigation really disappointed all i have now is a charge that doesn't work
137,horrible horrible protect
138,rip off over charge shipping
139,case was more or less an extra that i originally put on but later discarded because it scratched my ear
140,invest also had problems with the phone reading the memory card in which i always turn it on and then off again
141,piece of junk
142,the case is a flimsy piece of plastic and has no front or side protection whatsoever
143,the battery is completely useless to me
144,the biggest complaint i have is the battery drains super
145,so i had to take the battery out of the phone put it all back together and then rest it
146,bad purchase
147,it was horrible
148,perhaps my phone is defective but people cannot hear me when i use this
149,not only will it drain your player but may also potentially fry it
150,improper description i had to return it
151,cant get the soft to work with my computer
152,i did not bother contacting the company for few dollar product but i learned the lesson that i should not have bought this form one anyway
153,reaching for the bottom row is uncomfortable and the send and end keys are not where i expect them to be 3
154,the calls drop the phone comes on and off at will the screen goes black and the worst of all it stops ringing intermittently
155,the commercials are the most misleading
156,steer clear of this product and go with the genuine palm replacement pens which come in a three-part
157,i don't think it would hold it too securely on your belt
158,it makes very strange ticking noises before it ends the call
159,i kept catching the cable on the seat and i had to pull the phone out to turn it on an off
160,piece of trash
161,not a good item it worked for a while then started having problems in my auto reverse tape player
162,then a few days later the a puff of smoke came out of the phone while in use
163,then i exchanged for the same phone even that had the same problem
164,cumbersome design
165,all three broke within two months of use
166,one thing i hate is the mode set button at the side
167,while i managed to bend the leaf spring back in place the metal now has enough stress that it will break on the next drop
168,the camera although rated at an impressive 1 3 megaton renders images that fall well below expectations of such a relatively high resolution
169,the screen does get smudged easily because it touches your ear and face
170,item does not match picture
171,do not buy do not buy suck
172,doesn't work
173,sprinted charges for this service
174,i am not impressed with this and i would not recommend this item to anyone
175,this is essentially a communications tool that does not communicate
176,stay away from this store be careful
177,it's a piece of crap
178,sucked most of the stuff does not work with my phone
179,adapter does not provide enough charging current
180,talk about useless customer service
181,what a big waste of time
182,tied to charge for conversations lasting more than 45 minutes major problems
183,you also cannot take pictures with it in the case because the lenses is covered
184,don't make the same mistake that i did and please don't buy this phone
185,the construction of the heads is poor
186,it's uncomfortable and the sound quality is quite poor compared with the phone razor or with my previous wired heads that plugged into an laws
187,no additional ear gel provided and no instructions whatsoever
188,echo problem very unsatisfactory
189,these products cover up the important light sensor above the ear outlet
190,and none of the tones is acceptable
191,don't waste your money
192,this is infuriating
193,the loudspeaker option is great the bumpers with the lights is very appealing
194,it clicks into place in a way that makes you wonder how long that mechanism would last
195,i found this product to be way too big
196,the instructions didn't explain that a microphone jacket could be used
197,uncomfortable in the ear don't use with laws voters envy
198,you have to hold the phone at a particular angle for the other party to hear you clearly
199,can't unload restoring from a third party
200,do not make the same mistake as me
201,i might have gotten a defect but i would not risk buying it again because of the built quality alone
202,not worth it
203,you could only take 2 video at a time and the quality was very poor
204,if you plan to use this in a car forget about it
205,i have 2-3 bars on my cell phone when i am home but you cant not hear anything
206,battery has no life
207,the interne access was fine it the rare instance that it worked
208,shaggy floppy piece of junk
209,wont work right or apostle for me
210,don't waste your on this one
211,audio quality is poor very poor
212,invest missed numerous calls because of this reason
213,the item received was counterfeit
214,this product had a strong rubber petroleum smell that was unbearable after a while and caused me to return it
215,first off the reception suck i have never had more than 2 bars ever
216,don't bother go to the store
217,very disappointed
218,kind of flops around
219,the pleats case doesn't fit
220,no real improvement
221,truly awful
222,invest bought 5 wired headstones that sound better than these
223,as an earlier review noted plug in this charge and nothing happens
224,after the first charge kept going dead after 12 minutes
225,i does not maintain a connection with the computer while it is on my lap
226,disappointment i hate anything that goes in my ear
227,warning stay away
228,very disappointing performance
229,do not buy if you want to use the holster
230,veteran's bills however are difficult to understand even though their pricing plans are simple
231,chines forgeries abound
232,it lasts less than 31 minutes if i actually try to use the phone my wife has the same phone with the same problem
233,not what i wanted
234,who in their right mind is gonna buy this battery
235,battery lasts only a few hours
236,i can't use this case because the smell is disgusting
237,you need at least 3 min to get to your phone book from the time you first turn on the phone battery life is short
238,they made this case too small and is very difficult to install
239,this phone might well be the worst invest ever had in any brand
240,all i can do is whine on the interne so here it goes the more i use the thing the less i like it
241,avoid this one if you can
242,the text massaging feature is really tricky to use
243,the cable looks so thin and flimsy it is scary
244,i received my supposedly new motor 375 and apparently there was not a match between the phone and the charge
245,obviously there is a problem with the adhesive
246,the volume switch rocket out of the unit to a destination unknown
247,even in my been 3 series which is fairly quiet i have trouble hearing what the other person is saying
248,this product is very high quality chines crap
249,verie teach support walked my through a few procedures none of which worked and i ended up having to do a hard re-set wiping out all my data
250,we received a white colored battery that goes dead after a couple hours original used to last a week but still lasts longer than there
251,my phone sounded oks not great oks but my wife's phone was almost totally unintelligible she couldn't understand a word being said on it
252,they refuse to refund or replace
253,that's a huge design flaw unless investigation not using it correctly which i don't think is the case
254,the worst phone invest ever had only had it for a few months
255,the sound quality for the device is unacceptable unless you are in a really quiet area you almost hear nothing
256,investigation trying to return it for a refund
257,i went on motor web and followed all directions but could not get it to pair again
258,the only thing that i think could improve is the sound leaks out from the heads
259,don't waste your money
260,last time buying from you
261,i would have given no star if i was able
262,however the ear pads come off easily and after only one week i lost one
263,however i needed some better instructions
264,i have two more years left in this contract and i hate this phone
265,after 3 months screen just went black all of a sudden
266,it is usable in a moving car at freeway speed
267,i contacted the company and they told me that although the unit was still under warranty if i couldn't produce my receipt i was out of luck
268,very cheap plastic creaks like an old wooden floor
269,the real killer is the volume and of course it breaking
270,don waste your money
271,in addition it feels amp looks as if the phone is all lightweight cheap plastic
272,i was sitting in my vehicle with the cradle on my belt and the heads lost signal
273,i recently had problems where i could not stay connected for more than 10 minutes before being disconnected
274,what a waste of money and time
275,i only hear garbage for audio
276,the replacement died in a few weeks
277,the holster that arrived did not match the photo in the ad
278,reception is terrible and full of static
279,the plastic breaks really easy on this clip
280,however restoring are not the best and neither are the games
281,first of all it doesn't wear well
282,this product is clearly not ready for prime time i don't care how cool it looks if you can't tell a call is coming in it's worthless
283,if there is a wind it is completely useless
284,interne is excruciating slow
285,bad fit way too big
286,blue does not work phone locks up screens just flash up and now it just makes calls randomly while in my pocket locked
287,waste of money
288,it didn't charge for me
289,sprinted terrible customer service
290,people could hear me talk and i had to pull out the earphones and talk on the phone
291,design flaw
292,the nooks can us cable did not work with my phone
293,the battery runs down quickly
294,my 52-year old nooks 216 from track holds the charge a lot better than this
295,useless phone simply deaf
296,battery life still not long enough in motor razor voters
297,the battery life is highly unacceptable
298,i wouldn't recommend buying this product
299,if you have several dozen or several hundred contacts then imagine the fun of sending each of them one by one
300,worthless product
301,using all earliest left or right this thing will not stay on my ear
302,i ordered this for sonny esoteric which but i think it only worked once that when i first used it
303,if you simply want a small flip phone look elsewhere as the extra bells whistle are mediocre
304,if you like a loud buzzing to override all your conversations then this phone is for you
305,it didn't work people can not hear me when i talk
306,if you don't find it too bad as again the unit comes with one ear only i would not recommend this to anyone
307,low quality
308,a piece of junk that broke after being on my phone for 2 days
309,how stupid is that
310,it was an inexpensive piece but i would still have expected better quality
311,does not charge the circulating att 85 phone
312,i have to jiggling the plug to get it to line up right to get decent volume
313,so just beware
314,i cannot make calls at certain places
315,not good enough for the price
316,i am going to have to be the first to negatively review this product
317,terrible product and waste of money
318,disappointing
319,the battery is unreliable as well as the service use antenna
320,i was not happy with this item
321,bad reception
322,i give wire 1 star i will contact circulating at t and inform them of this practice
323,when i placed my tree into the case not only was it not snug but there was a lot of extra room on the sides
324,i have this phone and it is a thorn in my side i really abhorred it
325,unfortunately it's easy to accidentally activate them with the gentle buttons if you accidentally touch the phone to your face while listening
326,but now that it is out of warranty the same problems recur bottom line put your money somewhere else circulating will not support it
327,does not work for listening to music with the circulating 81
328,the update procedure is difficult and cumbersome
329,you need two hands to operate the screen this soft interface is decade old and cannot compete with new soft designs
330,so i basically threw my money out the window for nothing
331,warning do not buy
332,worst ever
333,disappointed
334,it would take too long to describe how bad my customer service experience has been with amazons
335,painful on the ear
336,investigation returning them
337,very displeased
338,the instruction manual is lacking
339,voice quality signal strength dropped calls
340,the phone gets extremely hot
341,used and dirty
342,the majority of the logic ear heads failed
343,it did not work in my cell phone plug i am very up set with the charge
344,don't trust their web and don't expect any helpful support
345,i had to purchase a different case
346,i still maintain that monkeys shouldn't make headstones we just obviously don't share enough didn to copy the design over to humans
347,i want my money back
348,no buyers remorse on this one
349,however been heads are currently not good for real time games like first-place shooters since the audio delay messes me up
350,the ear buds only play music in one ear
351,worst phone ever
352,poor voice clarity
353,it loosest connection to the phone even when it is within a couple feet between the two
354,terrible phone holder
355,the eyepiece on this is too large or too heavy it keeps falling out of my ear
356,don't buy it
357,really ugly
358,i used to talk on it for 1 1 1 2 hours and the battery would be literally drained and dying
359,having trouble with volume
360,also the phone doesn't seem to accept anything except cobra mph preferably ripped by windows media player
361,buyer beware you could flush money right down the toilet
362,how can that be the audio quality is poor
363,buttons are too small
364,save your money invest had this item for 11 months now
365,for a product that costs as much as this one does i expect it to work far better and with greater ease than this thing does
366,the charge arrived within the promised time but it did not work
367,same problem as others have mentioned
368,this allows the possibility of double booking for the same date and time after the first
369,disappointed
370,if you hate ear avoid this phone by all means
371,another note about this phone appearance is that it really looks rather bland especially in the all black model
372,i didn't want the clip going over the top of my ear causing discomfort
373,then i had to continue pair it periodically since it somehow kept dropping
374,my only complaint is the standard sound volume is a little low even when turned up to 5 of 5
375,unfortunately it will not rechartering my ironed 402 despite connecting it from multiple power sources intimacy external battery wall outlet etc.
376,buy a different phone but not this
377,makes it easier to keep up with my blue when investigation not wearing it
378,i don't like this nooks either
379,customer service was terrible
380,i have had problems wit hit dropping signal and more
381,you can not answer calls with the unit never worked once
382,utter crap sound quality is terrible
383,poor quality
384,also if your phone is dropped this case is not going to save it specially when dropped face down
385,mice doesn't work
386,the no stated it my son was disappointed
387,i got this phone around the end of may and investigation completely unhappy with it
388,it is practically useless and did not add any kind of boost to my reception after i bought it
389,i bought this phone as a replacement for my start and have regretted it since
390,do not buy for deserves wrongly advertised for deserves
391,obviously they have a terrible customer service so you get what you pay for
392,there was so much hyped-up over this phone that i assumed it was the best my mistake
393,not nearly as good looking as the amazons picture makes it look
394,the buttons for on and off are bad
395,tree and two-mile refused to replace it again and forced me to buy another phone without any kind of upgrade discount
396,as i said above pretty useless
397,the charge worked for about a week and then completely stopped charging my phone
398,the plug did not work very well
399,however after about a year the flip started to get loose and wobbly and eventually my screen went black and i couldn't receive and place calls
400,the price was very good and with the free shipping and all it was a good purchase
401,i was very excited to get this heads because i thought it was really cute
402,the phone loads super
403,works as described
404,works fine
405,superb phone on a great network
406,razor battery good buy
407,car charge as well as act charge are included to make sure you never run out of juice high recommended
408,worth every penny
409,the sound is clear and the people i talk to on it are amazed at the quality too
410,after trying many many hands gadgets this is the one that finally works well
411,definitely a bargain
412,plan on ordering from them again and again
413,for the price this was a great deal
414,i recommend invigorating to anyone with different brand cell phones mph players in the family
415,overall i am psyche to have a phone which has all my appointments and contacts in and gets great reception
416,jawbone era is awesome too
417,good product incredible value
418,highly recommend for any one who has a blue tooth phone
419,the file brows offers all the options that one needs hands is great
420,worked great
421,battery life is real good
422,plant blue excellent buy
423,investigation glad i found this product on amazons it is hard to find it wasn't high priced
424,it works great with a car charge especially if you cannot plug in two adapters at the same time
425,so far so good
426,great value
427,it fits my ear well and is comfortable on
428,gets a signal when other verie phones won't
429,excellent
430,i have to use the smallest earliest provided but it stays on pretty well
431,great product for the price
432,this item is fantastic and works perfectly
433,great eyepiece
434,i received it quickly and it works great
