,text
1492,shot in the southern carnival desert using his patent fault documentary style waking creates a film like no other
1493,some applause should be given to the prelude however
1494,the fact is this film is a wonderful heart-warming tale about two people chasing their dreams
1495,the attractive set used throughout most of the film is an easing gem
1496,when aching and pavilion beautifully sing a duet from don ginning that perfectly describes their situation in the movie you appreciate the subtle layers of this excellent film
1497,it's also great to see that renowned silent screen fragrances marionettes hasn't missed a step going from silent to sound
1498,anyway the plot flowed smoothly and the martingale scenes were a hoot
1499,an excellent performance from museums
1500,people who like eloped films and art movies will like this movie
1501,the only thing really worth watching was the scenery and the house because it is beautiful
1502,after watching this film i wanted to learn more about the works of this artist
1503,overall i rate this movie a 10 out of a 1-1/2 scale
1504,if you have not seen this movie i definitely recommend it
1505,a happy wonderful feel good ending
1506,but tiny tons kept the 90 vibes and delivered one of the most popular funny and underrated cartoons ever created
1507,it presents a idyllic yet serious portrayal of the ups and downs of the characters lives
1508,a mature subtle script that suggests and occasionally brings into dramatic focus the underlying tensions is well served by perfect performances apart from the odd inappropriate smiling that keine knightly is prone to though perhaps under direction this time as the other characters themselves often mention it
1509,hitch is a great director
1510,and i really did find them funny
1511,a world better than 95 of the garbage in the theatres today
1512,clever and a real crowd this film still ranks among money's best films even after 80 wonderful years
1513,i would give this television series a 10 plus if i could
1514,it is a true classic
1515,brilliance indeed
1516,i highly recommend this movie for anyone interested in art poetry theater politics or jakes history
1517,all things considered a job very well done
1518,it really created a unique feeling though
1519,the point is the journey a journey that touches every member of the family
1520,this second appearance of mice mouse following the silent plane crazy earlier that year is probably his most famous film mostly because it was so grounding
1521,all in all i give this one a resounding 9 out of 10
1522,linden clinically is the only thing good in this film
1523,the warmth it generates is in contrast to its austere backdrop
1524,simply beautiful
1525,it's a feel film and that's how i felt when i came out of the cinema
1526,excellent performance
1527,i don't know exactly what it is about this movie but we latched on to this endearing movie and it has become a special part of our family's memories
1528,you truly take this journey through the eyes and soul of a child
1529,the characters were all funny and had the peculiarity of not having a true lead character
1530,here in the wind and the lion we see a wonderful rendering of all-American own imperial age
1531,overall the film is interesting and thoroughgoing
1532,see it with your kids if you have a chance it will open up some amazing dialogue about how far race relations have come in the last 50 years
1533,think of the film being like a dream
1534,10 10
1535,nine out of ten for a truly lovely film
1536,with great sound effects and impressive special effects i can't recommend this movie enough
1537,it is an excellent drama an excellent thrillers and an excellent film
1538,still i do like this movie for it's empower of women there's not enough movies out there like this one
1539,you wont regret it
1540,if you love death and decay and speakers lyrics this is the one
1541,conceptually the show offers a little bit of everything and for just about everybody parents kids fantasy and or further fans
1542,investigation glad the film didn't go for the most obvious choice as a lesser film certainly would have
1543,the music in the film is really nice too
1544,i can think of no other film where something vitally important occurs every other minute
1545,the cast is always entertaining as usual
1546,a very good film indeed about great and unconditional love
1547,truly on i love lucy
1548,also it's a real treat to see anthology quince playing crazy horse
1549,give this one a look
1550,alderman never is a great film
1551,the interplay between martini and emission contains the same wonderful chemistry we saw in wall street with martini and char
1552,fans of the genre will be in heaven
1553,call me a nut but i think this is one of the best movies ever
1554,via shillings did an excellent job with the script
1555,but the duet between the astronaut and his doctor at the beginning of the movie is a perfect exchange if one considers that this movie was made well into the cold war and the astronaut biggest fear is that he has crashed in the ussr
1556,his performance is simply genius
1557,his acting alongside olive de hand was brilliant and the ending was fantastic
1558,this is such a fun and funny movie
1559,it's still wild stuff though and is highly recommended to fans of gallon cinema
1560,this is actually a very smart movie
1561,there is a lot of beautiful places
1562,but above all the exquisite visual composition of each moment with inventive and elegant use of close-up camera angle and lighting including pointing fault home movie footage is a wonder and joy to behold
1563,i don't think you will be disappointed
1564,a good film by a great director
1565,highly recommended for all ages although the younger set will probably not appreciate some of the more subtle references they will certainly appreciate one galley scene in particular
1566,it is very educational for children 1 to 8 years old
1567,this is definitely one of the better documentaries i have seen looking at family relationships and marriage
1568,it is not just a cult it is a cult classic
1569,garb who showed right off the bat that her talents could carry over from the silent era i wanted to see some of her silent work but net doesn't seem to be stocking them
1570,there are some generally great things in it
1571,he owns the film just as space owned coal miner daughter and quaint owned great balls of fire
1572,for that it's worth checking out
1573,it's practically perfect in all of them a true masterpiece in a sea of fault masterpieces
1574,though the wind and the lion is told largely through the eyes of the son every member of the family can identify with one of the characters whether it be sea coroner's noble brigade candidacy bergs fist heroine john hustle wily john hay or stevedore kale specify radiant ruthless candor lieutenant rose big stick
1575,i think the most wonderful parts literally full of wonder are the excerpts from his works
1576,the art style has the appearance of crayons pencil drawings and is wonderfully colorful and fanciful
1577,barn is definitely super de duped
1578,i just saw this film and i recommend it
1579,it is a really good show to watch
1580,math jargon conned moved me to tears with his final monologue out brief candle out he gave the sphere of moral decay and dark forces a human face which makes it the more interesting
1581,all the actors give a wonderful performance especially jerk rubbing as jam harried who changes from the nervous starlet in the beginning through the strange events she is part of to the cool star
1582,in a most wonderful location lies a story of contrast
1583,not too scream not to masculine but just right
1584,a film not easily forgotten
1585,i loved this movie it was a great portrayal of a family who had it's share of ups and down but in the end they knew that special love they had for each other
1586,annex heck was utterly convincing
1587,the entire audience applauded at the conclusion of the film
1588,i think it was robber ransom best film because he portrayed someone like my father and he was a schizophrenic in real life my father although he never murdered anyone but was affected more so during the second world war which made him worse
1589,i had always known that error fly was a brilliant actor as he was my dad favorite actor and i grew up watching his films as a child
1590,it'd advise anyone to go and see it
1591,he is an amazing film artist one of the most important whoever lived
1592,the rest of the cast also play well
1593,the writers were smack on and i think the best actors and actresses were a bonus to the show these characters were so real
1594,the songs were the best and the muskets were so hilarious
1595,lange had become a great actress
1596,i would have caste her in that role after ready the script
1597,i rather enjoyed it
1598,i really liked that
1599,it is rare when a film takes the time to tell a worthy moral tale with care and love that doesn't fall into the trap of being overly syrupy or over indulgent
1600,highly unprofessional and rude to a loyal patron
1601,the building itself seems pretty neat the bathroom is pretty trip but i wouldn't eat here again
1602,overall i wasn't very impressed with no
1603,took an hour to get our food only 4 tables in restaurant my food was lukewarm warm our sever was running around like he was totally overwhelmed
1604,avoid at all cost
1605,the chicken wings contained the dries chicken meat i have ever eaten
1606,the ambiance here did not feel like a buffet setting but more of a dour indoor garden for tea and biscuits
1607,i think food should have flavor and texture and both were lacking
1608,we sat another ten minutes and finally gave up and left
1609,any grandmother can make a roasted chicken better than this one
1610,don go here
1611,the service was a little slow considering that were served by 3 people serve so the food was coming in a slow pace
1612,please stay away from the shrimp stir fried nodules
1613,costing that came with the salad was stale
1614,will not be back
1615,if it were possible to give them zero stars they'd have it
1616,i live in the neighborhood so i am disappointed i won't be back here because it is a convenient location
1617,how can you call yourself a steak if you can't properly cook a steak i don't understand
1618,it was a drive to get there
1619,never going back
1620,we got the food and apparently they have never heard of salt and the batter on the fish was chew
1621,the food was terrible
1622,won't go back
1623,it'd rather eat airline food seriously
1624,i think not again
1625,the selection was probably the worst invest seen in vinegar there was none
1626,would not go back
1627,insults profound debauchery and had to go outside for a smoke break while serving just to solidifies it
1628,host staff were for lack of a better word bitch
1629,as much as it'd like to go back i can't get passed the atrociously service and will never return
1630,total brunches fail
1631,unfortunately it only set us up for disappointment with our entries
1632,the food is about on par with deny which is to say not good at all
1633,i will never go back to this place and will never ever recommended this place to anyone
1634,your serve suck wait correction our serve herein sucked
1635,horrible don't waste your time and money
1636,not good for the money
1637,i don't recommend unless your car breaks down in front of it and you are starving
1638,i won't try going back there even if it's empty
1639,it was a pale color instead of nice and char and has no flavor
1640,when my order arrived one of the gyros was missing
1641,the scallops dish is quite appalling for value as well
1642,we'll never go again
1643,over rated
1644,my husband said she was very rude did not even apologize for the bad food or anything
1645,then as if i hadn't wasted enough of my life there they poured salt in the wound by drawing out the time it took to bring the check
1646,for a self proclaimed coffee cafe i was wildly disappointed
1647,but then they came back cold
1648,the live music on frigid totally blows
1649,drinks took close to 30 minutes to come out at one point
1650,very very disappointed ordered the 35 big bay platter
1651,the descriptions said yuh yuh sauce and another said eel sauce yet another said spicy mayor well none of the rolls had sauces on them
1652,before i go in to why i gave a 1 star rating please know that this was my third time eating at brachii burgeoned before writing a review
1653,we've have gotten a much better service from the pizza place next door than the services we received from this restaurant
1654,i immediately said i wanted to talk to the manager but i did not want to talk to the guy who was doing shots of firebug behind the bar
1655,the buffet at bell was far from what i anticipated
1656,i just wanted to leave
1657,she ordered a toasted enlist muffins that came out unassisted
1658,we won't be going back anytime soon
1659,invest never been treated so bad
1660,anyways the food was definitely not filling at all and for the price you pay you should expect more
1661,investigation not eating here
1662,i ordered almonds soup which was just warm and tasted like tomato soup with frozen meals
1663,the burgeoned had absolutely no flavor the meat itself was totally bland the burgeoned was overcooked and there was no charcoal flavor
1664,by this point my friends and i had basically figured out this place was a joke and didn't mind making it publicly and loudly known
1665,there is really nothing for me at post hope your experience is better
1666,i give it 2 thumbs down
1667,hell no will i go back
1668,i had high hopes for this place since the burners are cooked over a charcoal grill but unfortunately the taste fell flat way flat
1669,for service i give them no stars
1670,the staff are now not as friendly the wait times for being served are horrible no one even says his for the first 10 minutes
1671,we had so much to say about the place before we walked in that he expected it to be amazing but was quickly disappointed
1672,gave up trying to eat any of the crust teeth still sore
1673,ordered burgeoned rare came in we'll done
1674,this is was due to the fact that it took 20 minutes to be acknowledged then another 35 minutes to get our food and they kept forgetting things
1675,i was very disappointed
1676,we also ordered the spinach and avocado salad the ingredients were sad and the dressing literally had zero taste
1677,i can take a little bad service but the food suck
1678,as for the mains also uninjured
1679,my sash was poor quality being soggy and tasteless
1680,thoroughly disappointed
1681,i had the ma salad and it was pretty bland so i will not be getting that again
1682,as a sushi lover avoid this place by all means
1683,the cashews cream sauce was bland and the vegetables were undertook
1684,i will not be eating there again
1685,there is not a deal good enough that would drag me into that establishment again
1686,now the burners aren't as good the pizza which used to be amazing is dough and flavor
1687,just don't know why they were so slow
1688,your staff spends more time talking to themselves than me
1689,did not like at all
1690,the selection of food was not the best
1691,this one is simply a disappointment
1692,say bye bye to your tip lady
1693,the place was not clean and the food oh so stale
1694,2 times very bad customer service
1695,it was way over fried
1696,a fly was in my apple juice a fly
1697,spend your money elsewhere
1698,they never brought a salad we asked for
1699,i as well would given grandfathers zero stars if possible
1700,very tough and very short on flavor
1701,the warm beer didn't help
1702,friend's past also bad he barely touched it
1703,invest had better baggage from the grocery store
1704,this is a disgrace
1705,the only reason to eat here would be to fill up before a night of binge drinking just to get some car in your stomach
1706,soggy and not good
1707,by this time our side of the restaurant was almost empty so there was no excuse
1708,i asked multiple times for the wine list and after some time of being ignored i went to the hostess and got one myself
1709,i am far from a sushi connoisseur but i can definitely tell the difference between good food and bad food and this was certainly bad food
1710,we've tried to like this place but after 10 times i think we're done with them
1711,i can't tell you how disappointed i was
1712,weird vibes from owners
1713,will not be back
1714,disappointing experience
1715,now i am getting angry and i want my damn phone
1716,the service was not up to par either
1717,the sang was about half of a glass wine full and was 12 ridiculous
1718,there is nothing authentic about this place
1719,eel this location needs a complete overhaul
1720,i started this review with two stars but investigation editing it to give it only one
1721,on three different occasions i asked for well done or medium well and all three times i got the bloodiest piece of meat on my plate
1722,hot dishes are not hot cold dishes are close to room tempo i watched staff prepare food with bare hands no gloves everything is deep fried in oil
1723,do yourself a favor and stay away from this dish
1724,if you look for authentic that food go else where
1725,i hate those things as much as cheap quality black olives
1726,but now i was completely gross out
1727,i hate to disagree with my fellow yelped but my husband and i were so disappointed with this place
1728,we waited for thirty minutes to be seated although there were 8 vacant tables and we were the only folks waiting
1729,too bad cause i know it's family owned i really wanted to like this place
1730,the heart attack grill in downtown vinegar is an absolutely flat-bed excuse for a restaurant
1731,the burr blame
1732,the potatoes were like rubber and you could tell they had been made up ahead of time being kept under a warmer
1733,the service here leaves a lot to be desired
1734,this place is horrible and way overpriced
1735,perhaps i caught them on an off night judging by the other reviews but investigation not inspired to go back
1736,it was a bit too sweet not really spicy enough and lacked flavor
1737,the pan cakes everyone are raving about taste like a sugar disaster tailored to the palate of a six year old
1738,why are these sad little vegetables so overcooked
1739,it was not good
1740,no one at the table thought the food was above average or worth the wait that we had for it
1741,this place is not quality sushi it is not a quality restaurant
1742,it was a huge awkward 1 50 piece of cow that was 3 4th grist and fat
1743,i was disgusted because i was pretty sure that was human hair
1744,the service was terrible though
1745,service was slow and not attentive
1746,my brother in law who works at the mall ate here same day and guess what he was sick all night too
1747,the potato chip order was sad i could probably count how many chips were in that box and it was probably around 12
1748,the kids play area is nasty
1749,probably never coming back and wouldn't recommend it
1750,not tasty and the texture was just nasty
1751,i vomiting in the bathroom mid lunch
1752,if there were zero stars i would give it zero stars
1753,do not waste your money here
1754,like the other reviewer said you couldn't pay me to eat at this place again
1755,seafood was limited to boiled shrimp and crabs legs but the crabs legs definitely did not taste fresh
1756,boy was that suckers dry
1757,walked in and the place smelled like an old grease trap and only 2 others there eating
1758,i checked out this place a couple years ago and was not impressed
1759,this place deserves no stars
1760,on the ground right next to our table was a large smeared better-than-average pile of green bird pop
1761,worst food service invest had in a while
1762,we asked for the bill to leave without eating and they didn't bring that either
1763,it was equally awful
1764,after all the ravenous reviews i couldn't wait to eat here what a disappointment
1765,ordered a double cheese got a single patted that was falling apart picture unloaded yeah still suck
1766,a lady at the table next to us found a live green caterpillar in her salad
1767,waited 2 hours never got either of our pizza as many other around us who came in later did
1768,it was attached to a gas station and that is rarely a good sign
1769,this is the worst sushi i have ever eat besides cost
1770,i probably won't be coming back here
1771,terrible management
1772,seems like a good quick place to grab a bite of some familiar pub food but do yourself a favor and look elsewhere
1773,my gyro was basically letter only
1774,i have watched their prices inflate portions get smaller and management attitudes grow rapidly
1775,ordered an appetizing and took 40 minutes and then the pizza another 10 minutes
1776,i took back my money and got outta there
1777,waiter was a jerk
1778,i wasn't really impressed with strip steak
1779,it was extremely crumbly and pretty tasteless
1780,then our food came out disappointment ensued
1781,frozen puckish of disgust with some of the worst people behind the register
1782,poor service the waiter made me feel like i was stupid every time he came to the table
1783,also the friezes are without a doubt the worst friezes invest ever had
1784,worst service to boot but that is the least of their worries
1785,invest lived here since 1970 and this was the first and last time invest stepped foot into this place
1786,pricing is a bit of a concern at mellowed mushroom
1787,i find wasting food to be desirable but this just wasn't food
1788,i got home to see the dries damn wings ever
1789,i would not recommend this place
1790,the friezes were not hot and neither was my burgeoned
1791,if you are reading this please don't go there
1792,the chicken dishes are oks the beef is like shoe leather
1793,not even a hello we will be right with you
1794,first time there and might just be the last
1795,appetite instantly gone
1796,the service here is fair at best
1797,this place is overpriced not consistent with their booboo and it really is overpriced
1798,it was so bad i had lost the heart to finish it
1799,i had about two bites and refused to eat anymore
1800,won't ever go here again
1801,the last 3 times i had lunch here has been bad
1802,the service was poor and that being nice
1803,this place should honestly be blown up
1804,the service was me
1805,the cash had no care what so ever on what i had to say it still ended up being way overpriced
1806,i waited and waited
1807,the fried rice was dry as well
1808,this place deserves one star and 90 has to do with the food
1809,we ordered some old classics and some new dishes after going there a few times and were sorely disappointed with everything
1810,my husband and i ate lunch here and were very disappointed with the food and service
1811,at least 40 passed in between us ordering and the food arriving and it wasn't that busy
1812,this place is disgusting
1813,we started with the tune sash which was brownish in color and obviously wasn't fresh
1814,sadly gone ram steak is a place we shall sharply avoid during our next trip to vinegar
1815,will never ever go back
1816,i mean really how do you get so famous for your fish and chips when it's so terrible
1817,must have been an off night at this place
1818,the chip ranch dipping sausage was tasteless seemed thin and watered down with no heat
1819,strike 2 who wants to be rushed
1820,i have been to very few places to eat that under no circumstances would i ever return to and this tops the list
1821,they dropped more than the ball
1822,i came back today since they related and still not impressed
1823,the spaghetti is nothing special whatsoever
1824,the waiter wasn't helpful or friendly and rarely checked on us
1825,worst martini ever
1826,never been to hard rock casino before will never ever step forward in it again
1827,overall i don't think that i would take my parents to this place again because they made most of the similar complaints that i silently felt too
1828,there is nothing privileged about working eating there
1829,which are small and not worth the price
1830,avoid this establishment
1831,bland not a liking this place for a number of reasons and i don't want to waste time on bad reviewing it'll leave it at that
1832,and the beans and rice were mediocre at best
1833,after waiting an hour and being seated i was not in the greatest of moods
1834,we aren't ones to make a scene at restaurants but i just don't get it definitely lost the love after this one
1835,definitely not worth the 3 i paid
1836,i guess maybe we went on an off night but it was disgraceful
1837,for about 10 minutes we we're waiting for her salad when we realized that it wasn't coming any time soon
1838,not much flavor to them and very poorly constructed
1839,probably not in a hurry to go back
1840,it was probably dirt
1841,waited and waited and waited
1842,the serve was very negligent of our needs and made us feel very unwelcome i would not suggest this place
1843,terrible service
1844,i wouldn't return
1845,best of luck to the rude and non-com service focused new management
1846,i don't think it'll be running back to car's anytime soon for food
1847,it's too bad the food is so damn genera
1848,this place is way too overpriced for mediocre food
1849,not good by any stretch of the imagination
1850,the shower area is outside so you can only rinse not take a full shower unless you don't mind being nude for everyone to see
1851,in summary this was a largely disappointing dining experience
1852,very slow at seating even with reservation
1853,not much seafood and like 5 strings of past at the bottom
1854,the burgeoned i got the gold standard a 17 burgeoned and was kind of disappointed
1855,the worst experience ever
1856,we could not believe how dirty the oysters were
1857,she was quite disappointed although some blame needs to be placed at her door
1858,it was packed
