,text
1197,this was a poor remake of my best friends wedding
1198,the results well are a shame
1199,everything stink
1200,it is an insane game
1201,now you know why i gave it a 10
1202,in other words the content level of this film is enough to easily fill a dozen other films
1203,punishment park is a brilliant piece of cinema
1204,this is high adventure at its best
1205,okay i like to consider myself a fair critic so it'll give credit where credit due the creature effects were actually pretty cool
1206,if you do watch it however there are small consolation the actresses playing anyone's sisters each do a wonderful job with their roles
1207,kiss kerosene is good in this movie and really makes a difference
1208,the movie was very interesting from beginning to the end
1209,everything from acting to chromatography was solid
1210,the film's sole bright spot was journal hill who will look almost unrecognizable to fans of the recent superb due to the amount of weight he lost in the interim
1211,go and see it
1212,i believe every one should see this movie as i think few people outside of south allegorical understand its past and what is being attempted in the truth and reconciliation process
1213,it features an outlandish array of memorable psychotic but lovable nuts
1214,i saw it as a child on tva back in 1970 when it was the stranger and i loved it
1215,i rate this movie 9 10
1216,the best scene in the movie was when garage is trying to find a song that keeps running through his head
1217,i guess i liked the details of his distinction he was believable
1218,plus it was well-braced and suited its relatively short run time
1219,yet i enjoy watching it
1220,it's one of the movies i need to see whenever it comes on tva never mind the fact that i already have it memorized
1221,gotta love those close-up of slim drooping teeth
1222,my mother and brother had to do this when i saw robber ran portraying this type of man it was a very good imitation of this type of individual and i was impressed
1223,an instant classic with a great sound-truck and a catchy song during the ending credits
1224,mark my words this is one of those cult films like evil dead 2 or phantasy that people will still be discovering and falling in love with 20 30 40 years down the line
1225,i saw this film over christened and what a great film it was
1226,if you are looking for a movie with a terrific cast some good music including a shirt joblessness rendition of the way you look tonight and an uplift ending give this one a try
1227,still it was the sets that got a big 10 on my over scale
1228,funny clever hip just like pray previous film hyped-up
1229,this is the kind of money that is wasted properly
1230,the camera really likes her in this movie
1231,it's hard not to fall head-on in love with that girl
1232,the suspense builders were good just cross the line from g to primary
1233,predictable but not a bad watch
1234,the result is a power achievement made more timely now perhaps because of our culture's disturbing fascination with celebrity and it's distorted interpretations of fame
1235,the movie is not completely perfect but titter di glamorous will stay with you for a long time after the vision of the movie
1236,i struggle to find anything bad to say about it
1237,the writer germane beard undoubtedly did his housework because all references are industry and character appropriate
1238,hopefully the director jam con can turn the short into a feature length film with the same cast or win us over with a whole new film
1239,the movie had you on the edge of your seat and made you somewhat afraid to go to your car at the end of the night
1240,this movie was kind of long in length but i enjoyed every minute of it
1241,despite the pans of reviewers i liked this movie
1242,however pause sadder has indeed made a film about mishap that is both superb complex
1243,but in terms of the writing it's very fresh and bold
1244,but it is entertaining nonetheless
1245,stevedore martini delivers a really funny performance of a middle-aged upper class upright white guy
1246,the cast of veteran actors are more than just a nostalgia trip
1247,how can anyone in their right mind ask for anything more from a movie than this
1248,totally different with loads of understatement and black comedy this is a film few get to see but those who do will remember it
1249,if there was ever a movie that needed worn-out to promote this is it
1250,you will leave the theater wanting to go out and dance under the stars
1251,the film is well paced understated and one of the best courtroom documentaries invest seen
1252,lovely little thrillers from hitch with lots of nice shenanigans surrounding a murdered spy a kidnapped child a nasty church a foreign plot and some random taxis
1253,the things that the four kids get themselves into is absolutely hilarious to watch
1254,some great music and terrific scenery
1255,the characters are interesting and you want to find out more about them the longer the movie goes on and i think people will be surprised by who does and doesn't make it
1256,i totally and absolutely recommend this movie to anyone who likes good wholesome family movies because that is exactly what this is
1257,but this movie really got to me
1258,what makes this story different are the terrific production values faultless photography composition and editing the terrific casting the unappreciated brilliant keine playing a bully teddy and vivid history
1259,is pretty funny
1260,there is however some pretty good acting at least for this type of film
1261,the sets especially designed to work with the camera are amazing stylized beautiful and effective
1262,her role was played well
1263,that was nice
1264,for people who are first timers in film making i think they did an excellent job
1265,this film highlights the fundamental flaws of the legal process that it's not about discovering guilt or innocence but rather is about who presents better in court
1266,at a time when it seems that film animation has been dominated by dish pioneer's cringing masterpieces it is both refreshing and comforting to know that mistaking is still relying on traditional hand-me-down animation to tell his charming and enchanting stories
1267,i have seen many movies starring jacket smithy but my god this was one of her best though it came out 12 years ago
1268,still it makes up for all of this with a super ending that depict a great sea vessel being taken out by the mighty frost
1269,all in all a beautiful directed film from nice roemer win a sublime cast
1270,i was particularly pleased with the acting ability of deadweight scheduled
1271,the ending is so so perfect you'll shed a tear
1272,the scenery that the two daughters paint and photograph are beautiful
1273,in addition to having one of the most lovely songs ever written frequency can also boasts one of the cutest leading ladies ever to grace the screen
1274,also notable is john bail fine crisp beautifully colored chromatography and the great production design costumes by ein is who went on to do the memorable costumes for copolymers drawback for which she received a well deserved oxcart
1275,usurp button portrayal of the nun is both touching and funny at the same time with out making fun of nuns or the church
1276,however after seeing the short again after about 25 years i was amazed at how timeless the film actually is
1277,great movie
1278,it looked like a wonderful story
1279,kale batter is wonderful in her characters subtle desperation and escapist a variation on her character in at play in the fields of the lord
1280,you share general lovelies exquisite joy in his partaking of the called en sage even though you are just watching a movie but you do wish for just a small sample to savor
1281,kilowatt never ceases to amaze me
1282,the cast is good
1283,the stories were powerful explorations of the nature of man and of art
1284,stand and morgen are perfectly cast in what is in many ways a modern equivalent of dicks christened carob in its sensibility
1285,the last 15 minutes of movie are also not bad as well
1286,this movie is possibly one of the most creative works of horror ever
1287,excellent cast story line performances
1288,feelings thoughts gab discomfort during the dance all these intangibles leap to life and come within the viewer grasp in hustle portrayal
1289,it was clear that she had the range and ability to pull off this part
1290,she's poised and amazing
1291,there still are good actors around
1292,and his subtle connections between the three films are awesome
1293,i thought error fly was brilliant as cluster and has since become my favorite actor
1294,julep fellow has triumph again
1295,you won't forget this movie
1296,three of the most visually appealing movies invest ever seen
1297,i like armata assailant my cable company's summary sounded interesting so i watched it twice already and probably will again
1298,it was so funny
1299,if good intentions made a film great then this film might be one of the greatest films ever made
1300,this if the first movie invest given a 10 to in years
1301,i advise you to look out for it
1302,i am so pleased to know such a modern day genius is out there letting is passion for art drive him and taking us as an audience with him
1303,special mention should be made of the superb music score and sound effects which are an integral element in helping to make this such a memorable and enjoyable cartoon
1304,the film deserves strong kaleidoscope for taking this stand for having exceptional acting from its mostly lesser-known cast and for the superintend script that doesn't insult the audience or take the easy way out when it comes to white racists
1305,i especially liked the non-church choices with the parents in other movies i could predict the dialogue verbatim but the writing in this movie made better selections
1306,each track commands sentiment actually contributing to the scenes and characters
1307,i really loved the story line and the pole bear was kinda cute but if anyone has a question about fort steeled just ask away
1308,definitely worth seeing it's the sort of thought proving film that forces you to question your own threshold of loneliness
1309,the film's dialogue is natural real to life
1310,recommend with confidence
1311,i love the scream movies and all horror movies and this one ranks way up there
1312,psi the only scene in the movie that was cool is when the central character finds her room blown up
1313,thanks good a movie like this was done and released
1314,as a eloped the movie is a nice throw to my time as a student in the 1980 and the experiences i had living abroad and interacting with other nationality although the circumstances were slightly different
1315,it's just adorable seeing mice playing turkey in the straw in a highly imaginative if occasionally cruel way
1316,it felt like a very gripping intelligent stage play but without the overly theatrical feeling one actually gets from watching people on a stage which plays on everyone's terror of a white lie escalation to monstrous consequences
1317,great character actors tell salad and petered boy
1318,but if you liked movies like the matrix and better yet their sequel i think you'll appreciate the thought proving mind experience this film will give you
1319,a great film by a great director
1320,don't miss it
1321,i do not know if this was emission estate director debut but the pacing the interplay and development of the characters as well as some clever camera work surrounding the character estate plays all suggest a natural eye
1322,brilliant
1323,while you don't yet hear mice speak there are tons of sound effects and music throughout the film something we take for granted now but which was a huge crowd please in 1928
1324,the chromatography is simply stunning to say the least and the further are nothing if not started
1325,jimmied steward is as ever a great hero for hitch the story rip along to its cool climax at an embassy function but it lacks the brooding menace of hitch black and white low-budget original
1326,this movie does an excellent job of revealing the complexity of the task and the incredible challenges facing south allegorical
1327,it was a riot to see hug weaving play a stressed gay real estate salesman who uses his clients houses for his trusts with the flaming dare tomb holder
1328,conclusion i loved it
1329,this mostly routine fact tva drama gets a boost from the fine performance by cooled
1330,chromatography noteworthy including fine views of baron and its famed gaudy towers
1331,the movie in movie situations in the beginning and through the game that is played with her by the acting coach are fascinating
1332,john way did an incredible job for being so young in the movie industry
1333,it's pure brilliance
1334,the movie i received was a great quality film for it's age
1335,it showed exactly how the government and the scientist argued for humanity and the reasons of the gadget
1336,i will never forget it now
1337,a very charming film with wonderful sentiment and heart
1338,also great directing and photography
1339,the movie is full of wonderful dancing hence the title
1340,it has a very good plot it holds your complete attention the acting is superb tomb winsome was fantastic and emit watt was also very good
1341,definitely worth checking out
1342,this movie creates its own universe and is fascinating in every way
1343,for readers who have already seen one of mistaking films he is still in top form and made another worthwhile experience
1344,plus with the movie rather modest budget and fast running time it does an amazing job
1345,i have recommended it to friends
1346,up there with the best of melee
1347,waste your money on this game
1348,hen bale is a very credible lady math who can be very cheerfully at times and sometimes she just looks like a naughty girl but deadly in her taste for blood and evil
1349,it's a gloriously fun fast paced and fairly accurate portrayal of the night of a ravenous
1350,this is an extraordinary film
1351,babies bop is very cute
1352,an amazing finale to possibly the best trilogy of all time
1353,they could be used as exemplar for any set designer
1354,go rent it
1355,i enjoyed reading this book to my children when they were little
1356,i have to mention this and it is a huge spoiled i loved the ending how all the characters of the three films were the remaining survivors of the ferry disaster with valet and the young judge together and the old man watching it on her tva solidifies his happiness over the suffering which he dealt with for those many years
1357,every single character was hilarious and deserved to be called a lead
1358,elite keynote jacket parlance play good roles angelic is hot and gets naked bill dragon appears in this and is cool as usual a cameos by seven ole those helps make this a very enjoyable movie with good acting and a decent budget
1359,10 out of 10 stars
1360,nevertheless yet another wonderful film from the great master's stable
1361,this is one of the best movies out there that shows such strong singling bond for each other
1362,but this understated film leaves a lasting impression
1363,much more interesting more action more suspense and less of the unneeded controversy
1364,this movie has a cutting edge to it
1365,i found this move beautiful enjoyable and uplift
1366,spoiled whatever else can or can't be said about it surface is superbly crafter
1367,i was totally fascinated by the music the dancing everything
1368,this is one of petered waking most accessible films
1369,this was such an awesome movie that i bought it off of eyeball
1370,also the music by mark snow is possibly the best score invest ever heard
1371,chromatography the film was shot in an interesting way
1372,there are massive levels massive unlock characters it's just a massive game
1373,but i thought his acting was skilled
1374,this is an excellent film
1375,when i first watched this movie in the 80 i loved it
1376,this movie is also revealing
1377,dammit is so talented and versatile in so many ways of writing and portraying different characters on screen
1378,this is truly an art movie it actually has a lot of art in it
1379,this movie contained an altar cast and what i loved the most was that it opened my eyes to see other actors who i haven't seen before
1380,this is the number one best the game in the series
1381,i didn't realize how wonderful the short really is until the last two scenes
1382,this movie is great especially if you enjoy visual arts
1383,enough can not be said of the remarkable animation in this film
1384,i gave it a 10
1385,i am so thrilled after seeing a movie like this
1386,it is wonderful and inspiring to watch and i hope that it gets released again on to video or disadvantage
1387,the kids are very cool too
1388,i saw this short film on highboy the other day and absolutely loved it
1389,i enjoyed it
1390,it was that year however that reminded us that hustle was still at the top of his game as evinced by his faithful adaptation of jam joy acclaimed novel the dead
1391,it was also the right balance of war and love
1392,both do good jobs and are quite amusing
1393,this early film from future greater lucid full is a very good addition to the gallon sub-group
1394,emit water's character is very strong and she has only to give a quick glance and you understand everything
1395,i thoroughly enjoyed it when cherish ecclesiastical took control of the tardy and the continuation of the series
1396,and i forgot the casting here i superb with trot fault aura being perfect in the role as the bothersome man who doesn't understand where he is what he is doing and why
1397,the characters are interesting and you really care for them
1398,see both films if you can
1399,during has a wholesome appearance and gives a fine performance
1400,angular scrim also turns in a good performance in a somewhat brief but memorable role as the gently menacing violating anatomic doctor quince
1401,i left the theater with a lilt in my step joy in my heart and hope for the human race
1402,they are so easy to love but even more easy to identify with
1403,an interesting premise and bill dragon is always good as a dangerous nut side note it'd love to see dragon step matting and lance hen in a flick together talk about raging cheekbones
1404,the memories are murky but i can only say that i enjoyed every single episode and product related to the show
1405,i liked this movie way too much
1406,the telephone repair man was really funny and his reactions to the nuts and bitch boss were truly genuine
1407,it was very popular when i was in the cinema a good house and very good reactions and plenty of laughs
1408,the film has great actors a master director a significant theme at least a would-be significant theme undertow of fifties existential weariness aerial scenes that ought to have thrilled both senses and imagination and characters about which one might deeply care
1409,having to humour him just to get by and get through the day was so apt
1410,all the characters in this film are tremendously well played
1411,buy it play it enjoy it love it
1412,excellent short film
1413,but keine space is an excellent verbal tsunami as buddy attacker and totally believable because he is a great actor
1414,the structure of this film is easily the most tightly constructed in the history of cinema
1415,his on screen presence shine thought even though there were other senior actors on the screen with him
1416,loved the casting of jimmied buffet as the science teacher
1417,the transfers are very good
1418,and there wasn't a single sour note struck acting either some surprisingly solid casting here
1419,this movie is so awesome
1420,it'll give this film 10 out of 10
1421,i believe the screen did a good job of tying up the loose ends
1422,it is a very well acted and done tva movie
1423,it ranks highly as a great non-dramas incredible performances by beyond and line venture
1424,it actually turned out to be pretty decent as far as blister horror suspense films go
1425,the characters are flesh out surprisingly well particularly grimed and blacked and all the actors deliver their sharply script lines with just the right amount of dead tongue in cheek to make the dialogue both hilarious and realistic
1426,in fact it's hard to remember that the part of ray charges is being acted and not played by the man himself
1427,being a 90 child i truly enjoyed this show and i can proudly say that i enjoyed it big time and even more than the classical which cartoons
1428,in fact i liked it better than interview with a vampires and i liked this lest start towns better than cruise attempt
1429,the acting is fantastic the stories are seamless woven together and the dogs are splendid a must rent view or see
1430,it's as continuously beautiful to look at as a berth but the relationships here are more convincing and the narrative more engaging than some of that master's work
1431,non-linear narration thus many flashback and every part are articulated quite well
1432,saw the movie today and thought it was a good effort good messages for kids
1433,this is one of the best italics thrillers of the early 70's
1434,the aerial scenes were well-to-do
1435,jubilant hander an exceptional actor who played supporting roles in many films of the era is a proud black man who is accused of murdering a white man in the south
1436,the film gives meaning to the phrase never in the history of human conflict has so much been owed by so many to so few
1437,there is a brilliant twist ending
1438,lifetime does not air it enough so if anyone knows what store sells it let me know because this is a must've
1439,i really hope the team behind this movie makes more movies and that they will continue to do so in their own some kinda weird style
1440,it was a long time that i didn't see a so charisma actor on screen
1441,constant gives everything the right intensity and seems to have a good understanding of the underlying psychological motivations
1442,secondly hitch pretty much perfected the thrillers and chase movie
1443,polo sorrel has written a wonderful story about loneliness and ton has built one of the most unforgettable characters seen in movies in recent years
1444,i think that it is a must see older john way film
1445,merited manner was better than all right
1446,i sat rivets to the tva screen
1447,it's a sad movie but very good
1448,if there was ever an indication of a writer and a director's ability to meld two highly volatile temperament into a seamless union of creativity then this is it
1449,and those baby owls were adorable
1450,this is a witty and delightful adaptation of the dry spouse book brilliantly animated by up finest and thoroughly deserving of its academy award
1451,the sound-truck wasn't terrible either
1452,he's a national treasure
1453,tomb winsome broke my heart at the end and everyone else's judging by the amount of fumbling for handiest and hands going up to faces among males and females alike
1454,this film offers many delights and surprises
1455,the good chromatography also makes her and monic bell look very beautiful
1456,not much dialogue not much music the whole film was shot as elaborately and anesthetically like a sculpture
1457,a good commentary of today's love and undoubtedly a film worth seeing
1458,as they say in canals this is the fun game aye
1459,there's barely a boring moment in the film and there are plenty of humorous parts
1460,as a courtroom drama it's compelling as an indictment on the all-American justice system it's frightening
1461,the acting as you'd expect from this cast is top notch
1462,the two main characters may be two of the most believable children i ever saw put on screen
1463,it never condescending all the characters have good genuine hearts and believable problems
1464,raw and sublime moving
1465,it has northern humour and positive about the community it represents
1466,the story which was told so eloquently by franc fords copper 25 years earlier really unfolds gradually and leaves room for the characters to develop
1467,he is one of my favorite directors and one of the most talented directors in the history of cinema
1468,their on-sure chemistry critical to the entire film is genuine
1469,it even has its sweet moments
1470,actually the graphic were good at the time
1471,this game rocks
1472,10 10
1473,i recommend this for everyone who loves film movies anything a work of art
1474,the story unfolds in 18th century jubilantly and the use of period music played on period instruments is just one more fine touch
1475,yes this film does require a rather significant amount of puzzling but the pieces fit together to create a beautiful picture
1476,the acting helps the writing along very well maybe the idiot sister could have been played better and it is a real joy to watch
1477,i won't spoil it but the ending in pretty amazing
1478,this review is long overdue since i consider a tale of two sisters to be the single greatest film ever made
1479,i couldn't think of a better way to end the film but a smile on my face great way to wrap up an amazing film and trilogy
1480,everything about this film is simply incredible
1481,i must say i have taped most of the episodes and i find myself watching them over and over again
1482,excellently produced by one of science's best producers scop veranda
1483,very nice and relaxing late night viewing
1484,i love it
1485,the attention given to every character and complex psychological portrayal detail loyalty treacheries love and hope are tremendous
1486,definitely worth checking out
1487,steamboat will is an amazingly important film to our cinema history
1488,the story is also both funny and poignant at times
1489,totally believable
1490,this is a very right on case movie that delivers everything almost right in your face
1491,still it's quite interesting and entertaining to follow
